{
  "$schema": "https://json-schema.org/draft/2020-12/schema",
  "$id": "https://aios.dev/schemas/framework-generator-payload.schema.json",
  "title": "AIOS Framework Generator Payload",
  "description": "Framework Generator payloads v0.9.1",
  "type": "object",
  "additionalProperties": false,
  "required": [
    "schema_version",
    "artifact_id",
    "type",
    "worker_id",
    "title",
    "summary",
    "entries",
    "status",
    "created_at"
  ],
  "properties": {
    "schema_version": {
      "$ref": "https://aios.dev/schemas/common.schema.json#/$defs/schemaVersion"
    },
    "artifact_id": {
      "$ref": "https://aios.dev/schemas/common.schema.json#/$defs/artifactId"
    },
    "type": {
      "type": "string",
      "enum": [
        "framework-generation",
        "framework-generation-status",
        "framework-generation-report",
        "gate-framework-generation-report"
      ]
    },
    "worker_id": {
      "$ref": "https://aios.dev/schemas/common.schema.json#/$defs/kebabId"
    },
    "title": {
      "type": "string",
      "minLength": 1
    },
    "summary": {
      "type": "string",
      "minLength": 1
    },
    "entries": {
      "type": "array",
      "minItems": 1,
      "items": {
        "type": "object",
        "additionalProperties": false,
        "required": [
          "id",
          "entry_kind",
          "statement",
          "generation_id",
          "target",
          "spec_ref",
          "output_plan",
          "evidence",
          "impact",
          "severity",
          "recommendation",
          "alternative_solution",
          "confidence",
          "source_paths",
          "unknowns",
          "traceability",
          "folder_mirror"
        ],
        "properties": {
          "id": {
            "type": "string",
            "minLength": 2
          },
          "entry_kind": {
            "type": "string",
            "minLength": 1
          },
          "statement": {
            "type": "string",
            "minLength": 1
          },
          "generation_id": {
            "type": "string",
            "minLength": 1
          },
          "target": {
            "type": "string",
            "minLength": 1
          },
          "spec_ref": {
            "type": "string",
            "minLength": 1
          },
          "output_plan": {
            "type": "object",
            "required": [
              "artifacts",
              "registries",
              "semver"
            ],
            "properties": {
              "artifacts": {
                "type": "array",
                "items": {
                  "type": "string"
                }
              },
              "registries": {
                "type": "array",
                "items": {
                  "type": "string"
                },
                "minItems": 1
              },
              "semver": {
                "type": "string"
              },
              "migration": {
                "type": [
                  "string",
                  "null"
                ]
              },
              "deprecation": {
                "type": [
                  "string",
                  "null"
                ]
              }
            }
          },
          "evidence": {
            "type": "array",
            "items": {
              "type": "string"
            }
          },
          "impact": {
            "type": "string",
            "minLength": 1
          },
          "severity": {
            "$ref": "https://aios.dev/schemas/common.schema.json#/$defs/severity"
          },
          "recommendation": {
            "type": "string"
          },
          "alternative_solution": {
            "type": "string"
          },
          "confidence": {
            "type": "number",
            "minimum": 0,
            "maximum": 1
          },
          "source_paths": {
            "type": "array",
            "items": {
              "type": "string"
            }
          },
          "unknowns": {
            "type": "array",
            "items": {
              "type": "string"
            }
          },
          "traceability": {
            "type": "object"
          },
          "folder_mirror": {
            "type": "string",
            "minLength": 1
          }
        }
      }
    },
    "status": {
      "$ref": "https://aios.dev/schemas/common.schema.json#/$defs/artifactStatus"
    },
    "created_at": {
      "type": "string",
      "format": "date-time"
    }
  }
}
