{
  "schema_version": "1.0.0",
  "artifact_id": "art_fg_test-generator_primary",
  "type": "framework-generation",
  "worker_id": "test-generator",
  "title": "Test Generator sample scaffold",
  "summary": "Sample framework-generation for test-generator",
  "entries": [
    {
      "id": "fg_test-generator_001",
      "entry_kind": "test-case",
      "statement": "Scaffold plan for test-case via Test Generator",
      "generation_id": "gen_test-generator_sample",
      "target": "core/packages/scaffold/generators/test-generator/",
      "spec_ref": "core/packages/configs/examples/test-generator.yaml",
      "output_plan": {
        "artifacts": [
          "core/packages/scaffold/generators/test-generator/test-case.json"
        ],
        "registries": [
          "workers",
          "skills",
          "schemas"
        ],
        "semver": "0.1.0",
        "migration": null,
        "deprecation": null
      },
      "evidence": [
        "core/packages/templates/worker/",
        "core/packages/schemas/worker-manifest.schema.json"
      ],
      "impact": "Enables configuration-driven Test Generator without manual coding",
      "severity": "info",
      "recommendation": "Review scaffold plan before execution phase",
      "alternative_solution": "Manual copy from core/packages/templates/",
      "confidence": 0.85,
      "source_paths": [
        "core/packages/configs/examples/test-generator.yaml",
        "core/packages/templates/worker/"
      ],
      "unknowns": [
        "UNKNOWN: execution phase not open"
      ],
      "traceability": {
        "spec_version": "0.1.0",
        "generator": "test-generator"
      },
      "folder_mirror": "core/packages/scaffold/generators/test-generator/test-case.json"
    }
  ],
  "status": "draft",
  "created_at": "2026-08-01T08:14:44Z"
}
