{
  "schema_version": "1.0.0",
  "artifact_id": "art_fg_worker-generator_primary",
  "type": "framework-generation",
  "worker_id": "worker-generator",
  "title": "Worker Generator sample scaffold",
  "summary": "Sample framework-generation for worker-generator",
  "entries": [
    {
      "id": "fg_worker-generator_001",
      "entry_kind": "worker-package",
      "statement": "Scaffold plan for worker-package via Worker Generator",
      "generation_id": "gen_worker-generator_sample",
      "target": "core/packages/scaffold/generators/worker-generator/",
      "spec_ref": "core/packages/configs/examples/worker-generator.yaml",
      "output_plan": {
        "artifacts": [
          "core/packages/scaffold/generators/worker-generator/worker-package.json"
        ],
        "registries": [
          "workers",
          "skills",
          "schemas"
        ],
        "semver": "0.1.0",
        "migration": null,
        "deprecation": null
      },
      "evidence": [
        "core/packages/templates/worker/",
        "core/packages/schemas/worker-manifest.schema.json"
      ],
      "impact": "Enables configuration-driven Worker Generator without manual coding",
      "severity": "info",
      "recommendation": "Review scaffold plan before execution phase",
      "alternative_solution": "Manual copy from core/packages/templates/",
      "confidence": 0.85,
      "source_paths": [
        "core/packages/configs/examples/worker-generator.yaml",
        "core/packages/templates/worker/"
      ],
      "unknowns": [
        "UNKNOWN: execution phase not open"
      ],
      "traceability": {
        "spec_version": "0.1.0",
        "generator": "worker-generator"
      },
      "folder_mirror": "core/packages/scaffold/generators/worker-generator/worker-package.json"
    },
    {
      "id": "fg_worker-generator_002",
      "entry_kind": "worker-readme",
      "statement": "Scaffold plan for worker-readme via Worker Generator",
      "generation_id": "gen_worker-generator_sample",
      "target": "core/packages/scaffold/generators/worker-generator/",
      "spec_ref": "core/packages/configs/examples/worker-generator.yaml",
      "output_plan": {
        "artifacts": [
          "core/packages/scaffold/generators/worker-generator/worker-readme.json"
        ],
        "registries": [
          "workers",
          "skills",
          "schemas"
        ],
        "semver": "0.1.0",
        "migration": null,
        "deprecation": null
      },
      "evidence": [
        "core/packages/templates/worker/",
        "core/packages/schemas/worker-manifest.schema.json"
      ],
      "impact": "Enables configuration-driven Worker Generator without manual coding",
      "severity": "info",
      "recommendation": "Review scaffold plan before execution phase",
      "alternative_solution": "Manual copy from core/packages/templates/",
      "confidence": 0.85,
      "source_paths": [
        "core/packages/configs/examples/worker-generator.yaml",
        "core/packages/templates/worker/"
      ],
      "unknowns": [
        "UNKNOWN: execution phase not open"
      ],
      "traceability": {
        "spec_version": "0.1.0",
        "generator": "worker-generator"
      },
      "folder_mirror": "core/packages/scaffold/generators/worker-generator/worker-readme.json"
    },
    {
      "id": "fg_worker-generator_003",
      "entry_kind": "worker-skill",
      "statement": "Scaffold plan for worker-skill via Worker Generator",
      "generation_id": "gen_worker-generator_sample",
      "target": "core/packages/scaffold/generators/worker-generator/",
      "spec_ref": "core/packages/configs/examples/worker-generator.yaml",
      "output_plan": {
        "artifacts": [
          "core/packages/scaffold/generators/worker-generator/worker-skill.json"
        ],
        "registries": [
          "workers",
          "skills",
          "schemas"
        ],
        "semver": "0.1.0",
        "migration": null,
        "deprecation": null
      },
      "evidence": [
        "core/packages/templates/worker/",
        "core/packages/schemas/worker-manifest.schema.json"
      ],
      "impact": "Enables configuration-driven Worker Generator without manual coding",
      "severity": "info",
      "recommendation": "Review scaffold plan before execution phase",
      "alternative_solution": "Manual copy from core/packages/templates/",
      "confidence": 0.85,
      "source_paths": [
        "core/packages/configs/examples/worker-generator.yaml",
        "core/packages/templates/worker/"
      ],
      "unknowns": [
        "UNKNOWN: execution phase not open"
      ],
      "traceability": {
        "spec_version": "0.1.0",
        "generator": "worker-generator"
      },
      "folder_mirror": "core/packages/scaffold/generators/worker-generator/worker-skill.json"
    }
  ],
  "status": "draft",
  "created_at": "2026-08-01T08:14:44Z"
}
