{
  "schema_version": "1.0.0",
  "artifact_id": "art_fg_reviewer-generator_primary",
  "type": "framework-generation",
  "worker_id": "reviewer-generator",
  "title": "Reviewer Generator sample scaffold",
  "summary": "Sample framework-generation for reviewer-generator",
  "entries": [
    {
      "id": "fg_reviewer-generator_001",
      "entry_kind": "architecture-review",
      "statement": "Scaffold plan for architecture-review via Reviewer Generator",
      "generation_id": "gen_reviewer-generator_sample",
      "target": "framework-generator/generators/reviewer-generator/",
      "spec_ref": "configs/examples/reviewer-generator.yaml",
      "output_plan": {
        "artifacts": [
          "framework-generator/generators/reviewer-generator/architecture-review.json"
        ],
        "registries": [
          "workers",
          "skills",
          "schemas"
        ],
        "semver": "0.1.0",
        "migration": null,
        "deprecation": null
      },
      "evidence": [
        "templates/worker/",
        "schemas/worker-manifest.schema.json"
      ],
      "impact": "Enables configuration-driven Reviewer Generator without manual coding",
      "severity": "info",
      "recommendation": "Review scaffold plan before execution phase",
      "alternative_solution": "Manual copy from templates/",
      "confidence": 0.85,
      "source_paths": [
        "configs/examples/reviewer-generator.yaml",
        "templates/worker/"
      ],
      "unknowns": [
        "UNKNOWN: execution phase not open"
      ],
      "traceability": {
        "spec_version": "0.1.0",
        "generator": "reviewer-generator"
      },
      "folder_mirror": "framework-generator/generators/reviewer-generator/architecture-review.json"
    }
  ],
  "status": "draft",
  "created_at": "2026-08-01T08:14:44Z"
}
