{
  "schema_version": "1.0.0",
  "artifact_id": "art_fg_generation-orchestrator_primary",
  "type": "framework-generation-status",
  "worker_id": "generation-orchestrator",
  "title": "Generation Orchestrator sample scaffold",
  "summary": "Sample framework-generation-status for generation-orchestrator",
  "entries": [
    {
      "id": "fg_generation-orchestrator_001",
      "entry_kind": "plan",
      "statement": "Scaffold plan for plan via Generation Orchestrator",
      "generation_id": "gen_generation-orchestrator_sample",
      "target": "core/packages/scaffold/status/generation-orchestrator/",
      "spec_ref": "core/packages/configs/examples/generation-orchestrator.yaml",
      "output_plan": {
        "artifacts": [
          "core/packages/scaffold/status/generation-orchestrator/plan.json"
        ],
        "registries": [
          "workers",
          "skills",
          "schemas"
        ],
        "semver": "0.1.0",
        "migration": null,
        "deprecation": null
      },
      "evidence": [
        "core/packages/templates/worker/",
        "core/packages/schemas/worker-manifest.schema.json"
      ],
      "impact": "Enables configuration-driven Generation Orchestrator without manual coding",
      "severity": "info",
      "recommendation": "Review scaffold plan before execution phase",
      "alternative_solution": "Manual copy from core/packages/templates/",
      "confidence": 0.85,
      "source_paths": [
        "core/packages/configs/examples/generation-orchestrator.yaml",
        "core/packages/templates/worker/"
      ],
      "unknowns": [
        "UNKNOWN: execution phase not open"
      ],
      "traceability": {
        "spec_version": "0.1.0",
        "generator": "generation-orchestrator"
      },
      "folder_mirror": "core/packages/scaffold/status/generation-orchestrator/plan.json"
    },
    {
      "id": "fg_generation-orchestrator_002",
      "entry_kind": "order",
      "statement": "Scaffold plan for order via Generation Orchestrator",
      "generation_id": "gen_generation-orchestrator_sample",
      "target": "core/packages/scaffold/status/generation-orchestrator/",
      "spec_ref": "core/packages/configs/examples/generation-orchestrator.yaml",
      "output_plan": {
        "artifacts": [
          "core/packages/scaffold/status/generation-orchestrator/order.json"
        ],
        "registries": [
          "workers",
          "skills",
          "schemas"
        ],
        "semver": "0.1.0",
        "migration": null,
        "deprecation": null
      },
      "evidence": [
        "core/packages/templates/worker/",
        "core/packages/schemas/worker-manifest.schema.json"
      ],
      "impact": "Enables configuration-driven Generation Orchestrator without manual coding",
      "severity": "info",
      "recommendation": "Review scaffold plan before execution phase",
      "alternative_solution": "Manual copy from core/packages/templates/",
      "confidence": 0.85,
      "source_paths": [
        "core/packages/configs/examples/generation-orchestrator.yaml",
        "core/packages/templates/worker/"
      ],
      "unknowns": [
        "UNKNOWN: execution phase not open"
      ],
      "traceability": {
        "spec_version": "0.1.0",
        "generator": "generation-orchestrator"
      },
      "folder_mirror": "core/packages/scaffold/status/generation-orchestrator/order.json"
    },
    {
      "id": "fg_generation-orchestrator_003",
      "entry_kind": "merge",
      "statement": "Scaffold plan for merge via Generation Orchestrator",
      "generation_id": "gen_generation-orchestrator_sample",
      "target": "core/packages/scaffold/status/generation-orchestrator/",
      "spec_ref": "core/packages/configs/examples/generation-orchestrator.yaml",
      "output_plan": {
        "artifacts": [
          "core/packages/scaffold/status/generation-orchestrator/merge.json"
        ],
        "registries": [
          "workers",
          "skills",
          "schemas"
        ],
        "semver": "0.1.0",
        "migration": null,
        "deprecation": null
      },
      "evidence": [
        "core/packages/templates/worker/",
        "core/packages/schemas/worker-manifest.schema.json"
      ],
      "impact": "Enables configuration-driven Generation Orchestrator without manual coding",
      "severity": "info",
      "recommendation": "Review scaffold plan before execution phase",
      "alternative_solution": "Manual copy from core/packages/templates/",
      "confidence": 0.85,
      "source_paths": [
        "core/packages/configs/examples/generation-orchestrator.yaml",
        "core/packages/templates/worker/"
      ],
      "unknowns": [
        "UNKNOWN: execution phase not open"
      ],
      "traceability": {
        "spec_version": "0.1.0",
        "generator": "generation-orchestrator"
      },
      "folder_mirror": "core/packages/scaffold/status/generation-orchestrator/merge.json"
    }
  ],
  "status": "draft",
  "created_at": "2026-08-01T08:14:44Z"
}
